{
  "schema_version": 1,
  "kind": "level",
  "id": "level-4",
  "version": 1,
  "name": "第四关 · 拌面（试玩）",
  "menu_order": 4,
  "ruleset_ref": {
    "id": "chefjeff-service",
    "version": 1
  },
  "map_ref": {
    "id": "level-4",
    "version": 1
  },
  "equipment_catalog_ref": {
    "id": "chefjeff-core",
    "version": 1
  },
  "recipe_catalog_ref": {
    "id": "chefjeff-service",
    "version": 2
  },
  "order_policy_ref": {
    "id": "level-4",
    "version": 1
  },
  "actors": [
    {
      "actor_id": "human",
      "controller_type": "human"
    },
    {
      "actor_id": "jeff",
      "controller_type": "agent"
    }
  ],
  "spawns": {
    "rule": "nearest_floor_to_center_shuffled",
    "centers": [
      [
        3.5,
        4.0
      ],
      [
        10.0,
        4.0
      ]
    ],
    "partition": {
      "axis": "x",
      "split": 7
    }
  },
  "initial_inventory": [
    {
      "object": "extinguisher",
      "id": "E1",
      "at": "extinguisher"
    },
    {
      "object": "plate",
      "id": "D1",
      "state": "clean",
      "at": "plates"
    },
    {
      "object": "plate",
      "id": "D2",
      "state": "clean",
      "at": "counter2"
    },
    {
      "object": "plate",
      "id": "D3",
      "state": "clean",
      "at": "counter3"
    },
    {
      "object": "pot",
      "id": "P1",
      "at": "p1"
    },
    {
      "object": "pan",
      "id": "P2",
      "at": "p2"
    },
    {
      "object": "pan",
      "id": "P3",
      "at": "counter4"
    }
  ],
  "clock": {
    "game_per_wall_default": 0.75,
    "game_per_wall_options": [
      0.5,
      0.75,
      1.0
    ]
  },
  "round_limit_game_ms": 180000,
  "goal": {
    "type": "minimum_money",
    "min_money": 140
  },
  "end_policy": {
    "type": "fixed_round"
  },
  "seeds": {
    "orders": 26,
    "spawn": 0
  },
  "extensions": {
    "chefjeff.status": "trial level: soup pot on stove 1, pans on stove 2 and counter 4; target 140 is a placeholder, not calibrated"
  }
}
