{
  "schema_version": 1,
  "kind": "level",
  "id": "level-1",
  "version": 4,
  "name": "第一关 · 牛排",
  "menu_order": 1,
  "ruleset_ref": {
    "id": "chefjeff-service",
    "version": 1
  },
  "map_ref": {
    "id": "level-1",
    "version": 4
  },
  "equipment_catalog_ref": {
    "id": "chefjeff-core",
    "version": 1
  },
  "recipe_catalog_ref": {
    "id": "chefjeff-service",
    "version": 2
  },
  "order_policy_ref": {
    "id": "level-1",
    "version": 2
  },
  "actors": [
    {
      "actor_id": "human",
      "controller_type": "human"
    },
    {
      "actor_id": "jeff",
      "controller_type": "agent"
    }
  ],
  "spawns": {
    "rule": "nearest_floor_to_center_shuffled",
    "centers": [
      [
        3.5,
        4.0
      ],
      [
        10.0,
        4.0
      ]
    ],
    "partition": {
      "axis": "x",
      "split": 7
    }
  },
  "initial_inventory": [
    {
      "object": "extinguisher",
      "id": "E1",
      "at_type": "tool_rack"
    },
    {
      "object": "plate",
      "id": "D1",
      "state": "clean",
      "at_type": "counter"
    },
    {
      "object": "plate",
      "id": "D2",
      "state": "clean",
      "at_type": "counter"
    },
    {
      "object": "pan",
      "id": "P1",
      "at_type": "stove"
    }
  ],
  "clock": {
    "game_per_wall_default": 0.75,
    "game_per_wall_options": [
      0.5,
      0.75,
      1.0
    ]
  },
  "round_limit_game_ms": 180000,
  "goal": {
    "type": "minimum_money",
    "min_money": 150
  },
  "end_policy": {
    "type": "fixed_round"
  },
  "seeds": {
    "orders": 26,
    "spawn": 0
  },
  "extensions": {
    "chefjeff.status": "calibrated: reference pair earns 300 on this fixed plan (slower-Jeff variant 200); target = 50%",
    "chefjeff.seeds": "fixed (owner decision B): every round of this level version gets the same orders and spawn sides"
  }
}
